<?xml version="1.0" encoding="UTF-8"?>

<updatesIndex xmlns="urn:com:atricore:liveservices:liveupdate:1.0:md"
        xmlns:xsi="http://www.w3.org/2001/XMLSchema-instance"
        xsi:schemaLocation="urn:com:atricore:liveservices:liveupdate:1.0:md
                    http://www.atricore.com/liveservices/liveupdate/atricore-liveupdate-md-1.0.xsd"
        ID="id0000001100">

<<<<<<< HEAD
    <updateDescriptor ID="id0000000200" description="JOSSO 2 EE 1.3.0-SNAPSHOT" IssueInstant="2010-12-25T19:32:52Z">
=======
    <updateDescriptor ID="id0000000200" description="JOSSO 2 EE 1.2.1-SNAPSHOT" IssueInstant="2010-12-25T19:32:52Z">
>>>>>>> 1.2.1

        <installableUnit ID="id0000000110"
                         group="com.atricore.josso"
                         name="com.atricore.josso.ee.install"
<<<<<<< HEAD
                         version="1.3.0-SNAPSHOT"
=======
                         version="1.2.1-SNAPSHOT"
>>>>>>> 1.2.1
                         description="JOSSO 2 EE"
                         updateNature="UPGRADE">



            <!-- Set of artifacts required for this install -->

            <!-- JOSSO 2 EE Update (distribution) -->
            <artifact ID="id0000000111"
                      group="com.atricore.josso"
                      name="josso-ee"
<<<<<<< HEAD
                      version="1.3.0-SNAPSHOT"
=======
                      version="1.2.1-SNAPSHOT"
>>>>>>> 1.2.1
                      type="tar.gz"
                      classifier="liveupdate"/>

            <!-- JOSSO 2 EE Update (distribution) -->
            <artifact ID="id0000000112"
                      group="com.atricore.josso"
                      name="josso-ee"
<<<<<<< HEAD
                      version="1.3.0-SNAPSHOT"
=======
                      version="1.2.1-SNAPSHOT"
>>>>>>> 1.2.1
                      type="zip"
                      classifier="liveupdate"/>


            <!-- JOSSO 2 EE Update (liveupdate installer) -->
            <artifact ID="id0000000113"
                      group="com.atricore.josso"
                      name="com.atricore.josso.ee.install"
<<<<<<< HEAD
                      version="1.3.0-SNAPSHOT"
=======
                      version="1.2.1-SNAPSHOT"
>>>>>>> 1.2.1
                      type="bundle"
                      classifier="liveupdate"/>


            <!-- Required features -->
            <requirement group="com.atricore.josso" name="josso-ee" description="JOSSO 2 EE 2.0.0" >
                <versionRange Expression="[1.9,2.0)"/>
            </requirement>

        </installableUnit>

    </updateDescriptor>

</updatesIndex>